{
  "version": "v2",
  "chainId": "167013",
  "secret": "0x8460bf597187f55609afd2aa7e714cf8a1da95291d7c09bc334fad6e81057161",
  "notes": [
    {
      "recipient": "0xe36C0F16d5fB473CC5181f5fb86b6Eb3299aD9cb",
      "amount": "100000000000000",
      "label": "note #0"
    }
  ],
  "targetAddress": "0x4c297fb4f94032949835e03f585c26f3de3bf0a4"
}
